{
  "schema_version": 1,
  "source_id": "SRC-254f3248",
  "run_id": "20261011-103154-ac03d1",
  "original_url": "https://docs.fixture.example/dialog-focus",
  "final_url": "https://docs.fixture.example/dialog-focus",
  "title": "Dialog focus management (fixture guidance)",
  "fetched_at": "2026-10-11T10:42:11.272Z",
  "publication_date": null,
  "http_status": 200,
  "content_type": "text/html",
  "source_type": "official_documentation",
  "content_sha256": "f1eb577d45d62a7a9921c2b1b5591507795ee34d5b309e0fa0a6a0f6da742e99",
  "available": true,
  "extraction": "trafilatura",
  "mode": "fixture",
  "fixture_dir": "evals/fixtures/case-01-award-packages",
  "gap_ids": [
    "GAP-005"
  ],
  "warnings": [
    "fixture mode: robots.txt not checked (no network)"
  ]
}
