{
  "schema_version": 1,
  "source_id": "SRC-bbbb0002",
  "run_id": "20261011-120000-abcdef",
  "original_url": "https://design.example.org/dialogs",
  "final_url": "https://design.example.org/dialogs",
  "title": "Dialog accessibility guidance",
  "fetched_at": "2026-10-11T10:00:00.000Z",
  "publication_date": null,
  "http_status": 200,
  "content_type": "text/html",
  "source_type": "design_system",
  "content_sha256": "d0466f738b8f6b602a955397c1094a8f06158b1c7dec38fab2d96e498b68ae5b",
  "available": true,
  "extraction": "trafilatura",
  "mode": "normal",
  "fixture_dir": null,
  "gap_ids": [
    "GAP-002"
  ],
  "warnings": []
}