{
  "schema_version": 1,
  "source_id": "SRC-c52222b5",
  "run_id": "20261011-103154-ac03d1",
  "original_url": "https://docs.fixture.example/confirmation-patterns",
  "final_url": "https://docs.fixture.example/confirmation-patterns",
  "title": "Confirming irreversible actions (fixture guidance)",
  "fetched_at": "2026-10-11T10:41:42.679Z",
  "publication_date": null,
  "http_status": 200,
  "content_type": "text/html",
  "source_type": "official_documentation",
  "content_sha256": "e8e5657d0378be345a3420438795d2de8fa09aa886502bc8e673bc8c062f4268",
  "available": true,
  "extraction": "trafilatura",
  "mode": "fixture",
  "fixture_dir": "evals/fixtures/case-01-award-packages",
  "gap_ids": [
    "GAP-004",
    "GAP-005"
  ],
  "warnings": [
    "fixture mode: robots.txt not checked (no network)"
  ]
}
